{
  "schemaVersion": 2,
  "catalogVersion": "2.0.0",
  "owner": "pdlc-governance",
  "stages": [
    { "id": "ideation-intake", "name": "Ideation intake", "description": "Capture the idea, sponsor context, and reason to explore it.", "phase": "discover", "roleSlots": ["product"], "requirements": ["State the idea without treating an untested solution as an approved requirement."], "outputs": ["idea-brief"] },
    { "id": "problem-framing", "name": "Problem framing", "description": "Define the user or business problem and the affected population.", "phase": "discover", "roleSlots": ["product"], "requirements": ["Identify the target user, current problem, and material business context."], "outputs": ["problem-statement"] },
    { "id": "stakeholder-context", "name": "Stakeholder context", "description": "Identify accountable stakeholders, users, and material dependencies.", "phase": "discover", "roleSlots": ["product"], "requirements": ["Record stakeholders whose decisions or operating responsibilities affect delivery."], "outputs": ["stakeholder-context"] },
    { "id": "business-architecture-alignment", "name": "Business architecture alignment", "description": "Align the proposed change to business capabilities and target operating boundaries.", "phase": "discover", "roleSlots": ["product"], "requirements": ["Identify affected business capabilities and material operating-model implications."], "outputs": ["business-capability-alignment"] },
    { "id": "hypothesis-definition", "name": "Hypothesis definition", "description": "State the testable belief that motivates the delivery effort.", "phase": "discover", "roleSlots": ["product"], "requirements": ["Express a falsifiable relationship between the proposed change and expected outcome."], "outputs": ["delivery-hypothesis"] },
    { "id": "success-measures", "name": "Success measures", "description": "Define observable measures used to judge the result.", "phase": "discover", "roleSlots": ["product", "qa"], "requirements": ["Define at least one observable success criterion and its evaluation method."], "outputs": ["success-criteria"] },
    { "id": "scope-definition", "name": "Scope definition", "description": "Set explicit in-scope and out-of-scope boundaries.", "phase": "define", "roleSlots": ["product", "developer", "qa"], "requirements": ["Record both included behavior and deliberate exclusions."], "outputs": ["scope-boundary"] },
    { "id": "requirements-clarification", "name": "Requirements clarification", "description": "Resolve material product decisions through focused conversation or document input.", "phase": "define", "roleSlots": ["product", "developer", "qa"], "requirements": ["Clarify product behavior, business rules, scenarios, and edge cases at the required depth."], "outputs": ["clarification-decisions", "resolved-ambiguities"] },
    { "id": "requirements-analysis", "name": "Requirements analysis", "description": "Turn clarified intent into coherent, traceable functional and quality requirements.", "phase": "define", "roleSlots": ["product", "developer", "qa"], "requirements": ["Identify contradictions, dependencies, quality attributes, and missing decisions."], "outputs": ["requirements-document"], "outputArtifacts": ["product-management.requirements"] },
    { "id": "acceptance-criteria-definition", "name": "Acceptance criteria definition", "description": "Define testable conditions for the approved behavior.", "phase": "define", "roleSlots": ["product", "qa", "developer"], "requirements": ["Make acceptance criteria observable, unambiguous, and traceable to requirements."], "outputs": ["acceptance-criteria"] },
    { "id": "data-integration-boundaries", "name": "Data and integration boundaries", "description": "Define data classification, persistence, interfaces, and external-system boundaries.", "phase": "define", "roleSlots": ["product", "developer", "qa"], "requirements": ["Record data sources, retention, sensitive-data handling, integrations, and explicit non-integrations."], "outputs": ["data-boundary", "integration-boundary"] },
    { "id": "risk-classification", "name": "Risk classification", "description": "Classify delivery risk and identify policy triggers.", "phase": "define", "roleSlots": ["product", "developer", "qa"], "requirements": ["Record risk level and all known governance, security, data, and operational triggers."], "outputs": ["risk-classification"] },
    { "id": "requirements-approval", "name": "Requirements approval", "description": "Present and approve the complete functional build contract.", "phase": "define", "roleSlots": ["product"], "requirements": ["Obtain explicit approval of a complete, reviewed, and content-bound Requirements document."], "outputs": ["approved-requirements"], "inputArtifacts": ["product-management.requirements"], "outputArtifacts": ["product-management.requirements"] },
    { "id": "work-item-planning", "name": "Work-item planning", "description": "Create or validate traceable delivery work items and external references.", "phase": "define", "roleSlots": ["product", "developer", "qa"], "requirements": ["Maintain traceability between requirements, delivery work, and test-management references when integrations apply."], "outputs": ["work-item-references"], "outputArtifacts": ["product-management.story"] },
    { "id": "solution-design", "name": "Solution design", "description": "Define the smallest suitable technical design and its material trade-offs.", "phase": "design", "roleSlots": ["developer", "product", "qa"], "requirements": ["Document boundaries, dependencies, data flow, key decisions, and reversibility."], "outputs": ["solution-design", "architecture-decisions"] },
    { "id": "ux-design", "name": "UX design", "description": "Define applicable interaction, visual, accessibility, and responsive behavior.", "phase": "design", "roleSlots": ["product", "developer", "qa"], "requirements": ["Apply enterprise UX standards and specify relevant interaction states."], "outputs": ["ux-design-decisions"] },
    { "id": "test-strategy", "name": "Test strategy", "description": "Define proportionate verification levels, environments, and evidence.", "phase": "design", "roleSlots": ["qa", "developer", "product"], "requirements": ["Map acceptance and risk to planned automated, manual, security, and non-functional verification."], "outputs": ["test-strategy", "evidence-plan"] },
    { "id": "delivery-planning", "name": "Delivery planning", "description": "Plan sequencing, dependencies, ownership, and delivery controls.", "phase": "design", "roleSlots": ["product", "developer", "qa"], "requirements": ["Identify dependencies, role assignments, and constraints that affect execution."], "outputs": ["delivery-plan"] },
    { "id": "build-readiness", "name": "Build readiness", "description": "Verify that the approved contract, applicable controls, design, and test plan are ready for implementation.", "phase": "design", "roleSlots": ["product", "developer", "qa"], "requirements": ["Block build when requirements, mandatory controls, design, or verification preparation is incomplete."], "outputs": ["build-readiness-decision"], "inputArtifacts": ["product-management.requirements"] },
    { "id": "implementation", "name": "Implementation", "description": "Implement the approved scope and applicable standards.", "phase": "build", "roleSlots": ["developer"], "requirements": ["Build only approved behavior and route material deviations through the controlled requirements process."], "outputs": ["implementation"] },
    { "id": "developer-verification", "name": "Developer verification", "description": "Run proportionate developer-owned checks and capture technical evidence.", "phase": "build", "roleSlots": ["developer"], "requirements": ["Verify core behavior and technical quality before independent acceptance verification."], "outputs": ["developer-test-evidence", "build-evidence"] },
    { "id": "security-verification", "name": "Security verification", "description": "Verify triggered security controls and document findings or exceptions.", "phase": "verify", "roleSlots": ["developer", "qa"], "requirements": ["Run the security checks required by risk, data, technology, and governance context."], "outputs": ["security-evidence"] },
    { "id": "test-case-preparation", "name": "Test-case preparation", "description": "Prepare traceable test cases and test-management records.", "phase": "verify", "roleSlots": ["qa"], "requirements": ["Trace planned test cases to acceptance criteria and applicable risk controls."], "outputs": ["test-cases", "test-management-references"] },
    { "id": "test-execution", "name": "Test execution", "description": "Execute the approved verification scope and capture reproducible evidence.", "phase": "verify", "roleSlots": ["qa", "developer"], "requirements": ["Record results, failures, deviations, and evidence for the planned verification scope."], "outputs": ["test-results", "verification-evidence"] },
    { "id": "acceptance-verification", "name": "Acceptance verification", "description": "Determine whether implemented behavior satisfies the approved acceptance criteria.", "phase": "verify", "roleSlots": ["qa", "product"], "requirements": ["Resolve material failures and obtain the required QA or Product acceptance decision."], "outputs": ["acceptance-decision", "qa-sign-off"] },
    { "id": "release-readiness", "name": "Release readiness", "description": "Evaluate operational, governance, change, and deployment controls before release.", "phase": "release", "roleSlots": ["product", "developer", "qa"], "requirements": ["Satisfy applicable tollgates, evidence requirements, rollback preparation, and separation-of-duty controls."], "outputs": ["release-readiness-decision"] },